"Tarih","Fon Kodu","Fon Adı","Fiyat","Tedavüldeki Pay Sayısı","Kişi Sayısı","Fon Toplam Değer"
"05.04.2021","RBA","ALBARAKA PORTFÖY ALTIN KATILIM FONU","1,726815","4.042.637,00","545","6.980.887,31"
"05.04.2021","RBH","ALBARAKA PORTFÖY KATILIM HİSSE SENEDİ FONU (HİSSE SENEDİ YOĞUN FON)","2,795133","43.151.171,00","4.632","120.613.254,15"
"05.04.2021","RBK","ALBARAKA PORTFÖY KATILIM FONU","1,385018","4.853.963,00","491","6.722.826,62"
"05.04.2021","RBT","ALBARAKA PORTFÖY KİRA SERTİFİKALARI  KATILIM FONU","1,365011","2.575.094,00","162","3.515.030,68"
"05.04.2021","RBV","ALBARAKA PORTFÖY KISA VADELİ KİRA SERTİFİKALARI KATILIM FONU","1,398471","33.478.183,00","267","46.818.267,05"
"05.04.2021","SBS","STRATEJİ PORTFÖY BAŞAK SERBEST (DÖVİZ) ÖZEL FON","8,376274","3.219.746,00","1","26.969.475,16"
"05.04.2021","SKT","FİBA PORTFÖY ŞEKERBANK KISA VADELİ BORÇLANMA ARAÇLARI FONU","0,023320","772.334.483,00","3.251","18.011.043,28"
"05.04.2021","SLF","FİBA PORTFÖY ŞEKERBANK PARA PİYASASI FONU","2,000199","61.718.764,00","7.424","123.449.789,15"
"05.04.2021","SPA","AZIMUT PORTFÖY 6.0 SERBEST (DÖVIZ) FON","7,978478","45.708.521,00","180","364.684.408,40"
"05.04.2021","SPD","AZIMUT PORTFÖY BEG SERBEST (DÖVIZ) ÖZEL FON","9,271230","7.799.853,00","1","72.314.228,20"
"05.04.2021","SPE","AZIMUT PORTFÖY 5.0 SERBEST (DÖVIZ) FON","10,437942","12.715.692,00","117","132.725.654,46"
"05.04.2021","SPG","AZİMUT PORTFÖY BEG SERBEST ÖZEL FON","1,483498","8.240.712,00","1","12.225.076,39"
"05.04.2021","SPN","AZIMUT PORTFÖY PİYASA NÖTR SERBEST FON","1,479131","248.916.965,00","185","368.180.677,57"
"05.04.2021","SRO","AZİMUT PORTFÖY SKY SERBEST ÖZEL FON","1,987070","314.135.344,00","6","624.208.962,98"
"05.04.2021","SRY","AZİMUT PORTFÖY SKY SERBEST (DÖVİZ) ÖZEL FON","15,474756","20.000,00","1","309.495,11"
"05.04.2021","SSO","AK PORTFÖY AK SANDIK SERBEST ÖZEL FON","1,910330","434.698.945,00","1","830.418.473,56"
"05.04.2021","STS","STRATEJİ PORTFÖY BİRİNCİ SERBEST (DÖVİZ) FON","9,947860","5.764.626,00","22","57.345.690,71"
"05.04.2021","STZ","STRATEJİ PORTFÖY HİSSE SENEDİ SERBEST FON (HİSSE SENEDİ YOĞUN FON)","1,113518","9.763.236,00","23","10.871.539,17"
"05.04.2021","ST1","STRATEJİ PORTFÖY BİRİNCİ HİSSE SENEDİ FONU(HİSSE SENEDİ YOĞUN FON)","19,089765","4.930.943,44","292","94.130.549,07"
"05.04.2021","SUA","ÜNLÜ PORTFÖY BİRİNCİ DEĞİŞKEN FON","0,074690","4.311.534.537,10","1.181","322.027.746,23"
"05.04.2021","SUB","ÜNLÜ PORTFÖY İKİNCİ DEĞİŞKEN FON","0,041245","205.406.157,00","244","8.471.949,46"
"05.04.2021","SUC","ÜNLÜ PORTFÖY ÜÇÜNCÜ DEĞIŞKEN FON","2,603479","40.008.929,00","855","104.162.391,19"
"05.04.2021","TAO","TEB PORTFÖY ALARKO GRUBU DEĞİŞKEN ÖZEL FON","2,828578","40.000.000,00","1","113.143.100,77"
"05.04.2021","TAU","İŞ PORTFÖY BİST BANKA ENDEKSİ HİSSE SENEDİ FONU (HİSSE SENEDİ YOĞUN FON)","0,040623","1.497.405.276,00","1.963","60.828.835,96"
"05.04.2021","TBP","İŞ PORTFÖY PRIVIA BANKACILIK DEĞİŞKEN ÖZEL FON","0,041963","1.176.669.377,00","127","49.376.510,23"
"05.04.2021","TBT","TEB PORTFÖY BORÇLANMA ARAÇLARI FONU","21,698209","921.962,52","1.078","20.004.935,87"
"05.04.2021","TBV","İŞ PORTFÖY ÖZEL SEKTÖR BORÇLANMA ARAÇLARI FONU","0,076732","1.548.516.427,00","1.062","118.820.855,58"
"05.04.2021","TCA","ZİRAAT PORTFÖY ALTIN KATILIM FONU","0,058720","7.630.784.233,16","8.595","448.081.679,24"
"05.04.2021","TCB","TACİRLER PORTFÖY KISA VADELİ BORÇLANMA ARAÇLARI FONU","0,046217","295.118.055,00","625","13.639.362,75"
"05.04.2021","TCC","TACİRLER PORTFÖY SERBEST ( DÖVİZ ) FON","0,011123","5.299.315.211,00","26","58.941.781,50"
"05.04.2021","TCD","TACİRLER PORTFÖY DEĞIŞKEN FON","5,154849","259.701.280,00","19.612","1.338.720.930,19"
"05.04.2021","TCI","TACİRLER PORTFÖY İSTATİSTİKSEL ARBİTRAJ SERBEST FON","1,434071","393.401.379,00","118","564.165.511,04"
"05.04.2021","TCS","TACİRLER PORTFÖY SİRİUS SERBEST FON","2,689534","35.210.260,00","40","94.699.176,65"
"05.04.2021","TDB","TEB PORTFÖY BOĞAZİÇİ SERBEST (DÖVİZ) FON","0,062519","383.092.831,00","10","23.950.744,89"
"05.04.2021","TDG","İŞ PORTFÖY YABANCI BORÇLANMA ARAÇLARI FONU","0,087899","1.114.532.338,00","1.840","97.966.480,10"
"05.04.2021","TDP","TEB PORTFÖY İKİNCİ SERBEST (DÖVİZ) FON","8,274358","50.398.957,00","164","417.019.017,06"
"05.04.2021","TE3","TEB PORTFÖY MUTLAK GETİRİ HEDEFLİ DEĞİŞKEN FON","5,916773","85.643.140,00","1.923","506.731.038,90"
"05.04.2021","TE4","TEB PORTFÖY BİRİNCİ DEĞİŞKEN FON","1,029128","60.509.357,00","192","62.271.865,32"
"05.04.2021","TFF","TEB PORTFÖY AMERİKA TEKNOLOJİ YABANCI BYF FON SEPETİ FONU","4,137056","6.718.410,00","1.005","27.794.441,69"
"05.04.2021","TGA","GARANTİ PORTFÖY DÖRDÜNCÜ DEĞİŞKEN FON","0,036603","405.333.377,00","1.086","14.836.543,29"
"05.04.2021","TGE","İŞ PORTFÖY EMTIA YABANCI BYF FON SEPETI FONU","0,029301","5.087.670.044,00","4.579","149.072.318,71"
"05.04.2021","TGR","AK PORTFÖY TURİZM VE SEYAHAT SEKTÖRÜ DEĞİŞKEN FON","0,000000","0,00","0","0,00"
"05.04.2021","TGT","GARANTİ PORTFÖY KISA VADELİ BORÇLANMA ARAÇLARI FONU","0,023704","21.142.972.310,00","68.772","501.171.493,48"
"05.04.2021","THG","TACİRLER PORTFÖY ODEABANK SERBEST ÖZEL FON","0,999836","400.000,00","5","399.934,26"
"05.04.2021","THV","ATA PORTFÖY ALTINCI SERBEST FON","1,156659","150.000,00","1","173.498,84"
"05.04.2021","TIE","İŞ PORTFÖY BIST 30 ENDEKSİ HİSSE SENEDİ FONU (HİSSE SENEDİ YOĞUN FON)","0,065162","496.878.984,00","1.735","32.377.506,28"
"05.04.2021","TIP","TEB PORTFÖY ING BANK ÖZEL BANKACILIK VE PLATİNUM SERBEST (DÖVİZ) ÖZEL FON","8,125256","7.665.378,00","66","62.283.161,40"
"05.04.2021","TIV","İŞ PORTFÖY KISA VADELI BORÇLANMA ARAÇLARI FONU","11,473879","326.414.553,00","87.668","3.745.241.186,48"
"05.04.2021","TI1","İŞ PORTFÖY PARA PİYASASI FONU","306,619645","20.741.873,00","87.370","6.359.865.728,46"
"05.04.2021","TI2","İŞ PORTFÖY HİSSE SENEDİ FONU (HİSSE SENEDİ YOĞUN FON)","78,962674","721.946,40","1.608","57.006.818,33"
"05.04.2021","TI3","İŞ PORTFÖY İŞ BANKASI İŞTİRAKLERİ ENDEKSİ HİSSE SENEDİ FONU (HİSSE SENEDİ YOĞUN FON)","100,901715","1.705.772,00","2.206","172.115.319,78"
"05.04.2021","TI4","İŞ PORTFÖY BİRİNCİ DEĞIŞKEN FON","92,370125","1.188.634,00","3.067","109.794.271,26"
"05.04.2021","TI6","İŞ PORTFÖY ORTA VADELİ BORÇLANMA ARAÇLARI FONU","120,964080","1.189.148,91","4.566","143.844.304,18"
"05.04.2021","TI7","İŞ PORTFÖY İKİNCİ DEĞİŞKEN FON","10,702584","16.174.336,00","4.775","173.107.188,00"
"05.04.2021","TKF","TACİRLER PORTFÖY HİSSE SENEDİ FONU (HİSSE SENEDİ YOĞUN FON)","7,022443","109.582.994,00","9.935","769.540.334,04"
"05.04.2021","TKK","İŞ PORTFÖY KUMBARA HESABI KARMA ÖZEL FON","0,218475","2.101.167.100,00","165.613","459.051.802,84"
"05.04.2021","TKM","TEB PORTFÖY PARA PİYASASI FONU","417,737242","2.784.237,00","18.940","1.163.079.484,70"
"05.04.2021","TLE","AURA PORTFÖY YABANCI BORÇLANMA ARAÇLARI FONU","3,523680","29.049.062,00","272","102.359.586,29"
"05.04.2021","TLH","AURA PORTFÖY HİSSE SENEDİ FONU (HİSSE SENEDİ YOĞUN FON)","2,261427","12.239.531,00","42","27.678.805,46"
"05.04.2021","TLY","TERA PORTFÖY BİRİNCİ SERBEST FON","1,011554","1.000.000,00","1","1.011.553,74"
"05.04.2021","TLZ","ATA PORTFÖY ANALİZ HİSSE SENEDİ FONU (HİSSE SENEDİ YOĞUN FON)","1,479503","9.020.752,00","154","13.346.229,68"
"05.04.2021","TMC","İŞ PORTFÖY TEMA  DEĞİŞKEN FON","0,028459","215.360.893,00","1.547","6.128.877,73"
"05.04.2021","TMG","İŞ PORTFÖY YABANCI HİSSE SENEDİ FONU","0,130129","891.093.394,00","2.670","115.957.528,91"
"05.04.2021","TMO","TEB PORTFÖY TEB GRUBU DEĞİŞKEN ÖZEL FON","0,000000","0,00","0","0,00"
"05.04.2021","TMR","TEB PORTFÖY MAKRO SERBEST FON","0,988646","4.075.000,00","4","4.028.733,74"
"05.04.2021","TNI","TEB PORTFÖY ING BANK ÖZEL BANKACILIK VE PLATİNUM DEĞİŞKEN ÖZEL FON","1,216541","120.090.676,00","378","146.095.260,93"
"05.04.2021","TNK","TEB PORTFÖY KISA VADELİ BORÇLANMA ARAÇLARI FONU","7,102689","72.017.163,00","27.136","511.515.500,05"
"05.04.2021","TOT","TEB PORTFÖY ÖZEL SEKTÖR BORÇLANMA ARAÇLARI FONU","189,864849","427.455,00","606","81.158.679,10"
"05.04.2021","TPC","TEB PORTFÖY BİRİNCİ FON SEPETİ FONU","1,703705","50.693.594,00","432","86.366.952,55"
"05.04.2021","TPE","İŞ PORTFÖY PY EUROBOND BORÇLANMA ARAÇLARI (DÖVİZ) ÖZEL FONU","0,062904","8.669.461.774,00","69","545.340.994,78"
"05.04.2021","TPF","TACİRLER PORTFÖY BORÇLANMA ARAÇLARI FONU","2,284474","20.048.944,00","335","45.801.281,72"
"05.04.2021","TPJ","TEB PORTFÖY BİRİNCİ SERBEST (DÖVİZ) FON","9,464592","32.146.829,00","186","304.256.608,79"
"05.04.2021","TPL","TEB PORTFÖY EUROBOND (DÖVİZ) BORÇLANMA ARAÇLARI FONU","2,816575","21.910.053,00","709","61.711.311,78"
"05.04.2021","TPO","İŞ PORTFÖY PY ÖZEL SEKTÖR BORÇLANMA ARAÇLARI ÖZEL FONU","0,030968","2.706.431.689,00","10","83.814.040,70"
"05.04.2021","TPP","TEB PORTFÖY PUSULA SERBEST FON","3,377225","15.710.000,00","56","53.056.203,21"
"05.04.2021","TPR","İŞ PORTFÖY PY HİSSE SENEDİ ÖZEL FONU (HİSSE SENEDİ YOĞUN FON)","0,023824","1.208.484.809,00","3","28.790.573,63"
"05.04.2021","TPV","AURA PORTFÖY İKİNCİ DEĞİŞKEN FON","2,334239","2.205.293,00","36","5.147.680,62"
"05.04.2021","TPZ","TEB PORTFÖY KİRA SERTİFİKALARI (DÖVİZ) KATILIM FONU","3,435080","5.035.000,00","253","17.295.626,22"
"05.04.2021","TRR","TEB PORTFÖY BEŞİNCİ SERBEST FON","1,118225","58.314.347,00","9","65.208.560,84"
"05.04.2021","TSI","İŞ PORTFÖY MAKSİMUM HESAP KISA VADELI BORÇLANMA ARAÇLARI FONU","0,043249","65.747.595.537,00","97.256","2.843.540.027,64"
"05.04.2021","TSP","AZİMUT PORTFÖY TESA SERBEST (DÖVİZ) ÖZEL FON","7,573628","15.338.705,00","3","116.169.638,28"
"05.04.2021","TTA","İŞ PORTFÖY ALTIN FONU","0,047894","11.613.272.798,00","12.016","556.202.985,43"
"05.04.2021","TTE","İŞ PORTFÖY BİST TEKNOLOJİ AĞIRLIKLI SINIRLAMALI ENDEKSİ HİSSE SENEDİ FONU (HİSSE SENEDİ YOĞUN FON)","0,150549","3.904.170.881,00","13.211","587.768.602,87"
"05.04.2021","TTL","TACİRLER PORTFÖY KARTOPU SERBEST FON","2,017665","121.111.489,00","5","244.362.390,49"
"05.04.2021","TTN","AZİMUT PORTFÖY TESA SERBEST ÖZEL FON","1,085127","100.599,00","1","109.162,67"
"05.04.2021","TTP","TEB PORTFÖY ÜÇÜNCÜ SERBEST (DÖVİZ) FON","8,131535","12.514.462,00","73","101.761.786,00"
"05.04.2021","TTS","TEB PORTFÖY DÖRDÜNCÜ SERBEST (DÖVİZ) FON","8,089371","18.125.312,00","1","146.622.376,35"
"05.04.2021","TTV","TACİRLER PORTFÖY VEGA SERBEST FON","1,160564","124.463.538,00","47","144.447.934,52"
"05.04.2021","TUA","TEB PORTFÖY ALTIN FONU","0,103911","2.571.134.243,21","4.904","267.167.880,71"
"05.04.2021","TYH","TEB PORTFÖY HİSSE SENEDİ FONU (HİSSE SENEDİ YOĞUN FON)","0,138667","162.195.778,44","1.287","22.491.278,36"
"05.04.2021","TZC","ZİRAAT PORTFÖY BÜYÜYEN ÇOCUKLARA YÖNELİK DEĞİŞKEN ÖZEL FON","0,027278","136.428.500,00","1.203","3.721.436,94"
"05.04.2021","TZD","ZİRAAT PORTFÖY HİSSE SENEDİ FONU (HİSSE SENEDİ YOĞUN FON)","0,203979","186.453.349,06","4.214","38.032.500,75"
"05.04.2021","TZH","ZİRAAT PORTFÖY TZH SERBEST ÖZEL FON","1,191181","2.915.667.978,00","1","3.473.087.500,58"
"05.04.2021","TZL","ZİRAAT PORTFÖY PARA PİYASASI FONU","0,024628","90.445.414.535,28","62.896","2.227.472.908,33"
"05.04.2021","TZP","TACİRLER PORTFÖY İSTATİSTİKSEL ARBİTRAJ SERBEST ÖZEL FON","1,022554","52.268.990,00","11","53.447.880,15"
"05.04.2021","TZT","ZİRAAT PORTFÖY BORÇLANMA ARAÇLARI FONU","0,032719","1.624.878.490,58","3.065","53.163.910,64"
"05.04.2021","TZV","ZİRAAT PORTFÖY KISA VADELİ BORÇLANMA ARAÇLARI FONU","192,084473","22.093.877,00","183.066","4.243.890.716,48"
"05.04.2021","UAP","ÜNLÜ PORTFÖY ALTINCI SERBEST (DÖVİZ) ÖZEL FON","0,000000","0,00","0","0,00"
"05.04.2021","UPD","ÜNLÜ PORTFÖY DÖRDÜNCÜ SERBEST (DÖVIZ) FON","2,873507","9.247.178,00","34","26.571.830,45"
"05.04.2021","UPH","ÜNLÜ PORTFÖY HİSSE SENEDİ FONU(HİSSE SENEDİ YOĞUN FON)","2,576115","13.105.496,00","586","33.761.269,62"
"05.04.2021","UPP","ÜNLÜ PORTFÖY PARA PİYASASI FONU","1,235186","35.044.885,00","308","43.286.961,26"
"05.04.2021","UPS","ÜNLÜ PORTFÖY BEŞİNCİ SERBEST (DÖVİZ) ÖZEL FON","8,852980","2.031.795,00","1","17.987.439,70"
"05.04.2021","USY","ÜNLÜ PORTFÖY MUTLAK GETİRİ HEDEFLİ SERBEST FON","0,023013","1.280.962.368,00","56","29.478.878,30"
"05.04.2021","VFK","ZİRAAT PORTFÖY İKİNCİ KISA VADELİ KİRA SERTİFİKALARI KATILIM FONU","1,089396","78.325.826,00","461","85.327.826,00"
"05.04.2021","VKR","ALBARAKA PORTFÖY İKİNCİ KISA VADELİ KİRA SERTİFİKALARI KATILIM FONU","0,000000","0,00","0","0,00"
"05.04.2021","VKT","ZİRAAT PORTFÖY VAKIFBANK KISA VADELİ BORÇLANMA ARAÇLARI FONU","0,024146","28.707.329.161,00","39.807","693.176.296,30"
"05.04.2021","VK6","ZİRAAT PORTFÖY VAKIFBANK PARA PİYASASI FONU","0,730698","3.458.982.017,00","92.210","2.527.472.616,77"
"05.04.2021","YAC","YAPI KREDİ PORTFÖY İKİNCİ FON SEPETİ FONU","1,962729","915.476.802,00","6.862","1.796.832.791,22"
"05.04.2021","YAK","YAPI KREDİ PORTFÖY KARMA FON","0,640412","386.461.928,45","125.937","247.494.698,23"
"05.04.2021","YAN","YAPI KREDİ PORTFÖY BİRİNCİ FON SEPETİ FONU","2,322044","603.541.131,00","4.879","1.401.448.868,87"
"05.04.2021","YAR","İŞ PORTFÖY RESAN DEĞİŞKEN ÖZEL FON","2,176106","34.000.000,00","1","73.987.599,58"
"05.04.2021","YAS","YAPI KREDİ PORTFÖY KOÇ HOLDİNG İŞTİRAK VE HİSSE SENEDİ FONU(HİSSE SENEDİ YOĞUN FON)","1,723032","883.727.266,00","7.453","1.522.690.273,82"
"05.04.2021","YAY","YAPI KREDİ PORTFÖY YABANCI TEKNOLOJİ SEKTÖRÜ HİSSE SENEDİ FONU","154,163431","12.808.797,00","12.153","1.974.648.097,95"
"05.04.2021","YBE","YAPI KREDİ PORTFÖY EUROBOND (DOLAR) BORÇLANMA ARAÇLARI FONU","0,228968","11.148.050.889,00","6.777","2.552.548.435,58"
"05.04.2021","YBP","YAPI KREDİ PORTFÖY PY BİRİNCİ DEĞİŞKEN ÖZEL FON","1,624057","129.865.850,00","69","210.909.551,77"
"05.04.2021","YBS","YAPI KREDİ PORTFÖY ÖZEL SEKTÖR BORÇLANMA ARAÇLARI FONU","0,027277","25.712.544.024,00","4.748","701.354.954,54"
"05.04.2021","YCK","YAPI KREDİ PORTFÖY CİHANGİR SERBEST FON","1,019330","88.019.500,00","73","89.720.945,51"
"05.04.2021","YCL","ATA PORTFÖY BEŞİNCİ SERBEST FON","0,956274","105.501.969,00","8","100.888.810,37"
"05.04.2021","YCS","AZİMUT PORTFÖY MYRA SERBEST (DÖVİZ) ÖZEL FON","8,109932","64.274.254,00","1","521.259.803,78"
"05.04.2021","YDI","YAPI KREDİ PORTFÖY İKİNCİ HİSSE SENEDİ FONU (HİSSE SENEDİ YOĞUN FON)","0,039555","6.164.264.787,00","2.617","243.824.527,46"
"05.04.2021","YDK","YAPI KREDİ PORTFÖY ÇALIŞAN HESAP KISA VADELİ BORÇLANMA ARAÇLARI FONU","0,023133","3.774.043.161,00","59.113","87.306.322,09"
"05.04.2021","YDP","YAPI KREDİ PORTFÖY PY ÜÇÜNCÜ DEĞİŞKEN ÖZEL FON","0,029250","37.280.620.620,00","107","1.090.446.903,00"
"05.04.2021","YEF","YAPI KREDİ PORTFÖY BIST 30 ENDEKSİ HİSSE SENEDİ FONU (HİSSE SENEDİ YOĞUN FON)","0,076694","1.455.722.571,92","3.091","111.645.709,19"
"05.04.2021","YFV","YAPI KREDİ PORTFÖY KİRA SERTİFİKALARI KATILIM FONU","0,019981","1.387.909.361,00","1.366","27.732.015,20"
"05.04.2021","YHP","YAPI KREDİ PORTFÖY PY PARA PİYASASI ÖZEL FONU","1,005544","100.000.000,00","1","100.554.403,55"
"05.04.2021","YHS","YAPI KREDİ PORTFÖY BİRİNCİ HİSSE SENEDİ FONU (HİSSE SENEDİ YOĞUN FON)","2,003251","46.248.977,00","2.141","92.648.294,39"
"05.04.2021","YHT","YAPI KREDİ PORTFÖY KISA VADELİ BORÇLANMA ARAÇLARI FONU","0,084073","4.849.746.561,00","92.532","407.731.149,60"
"05.04.2021","YHZ","YAPI KREDİ PORTFÖY TEKNOLOJİ ŞİRKETLERİ HİSSE SENEDİ FONU ( HİSSE SENEDİ YOĞUN FON)","1,009253","920.556,00","238","929.074,01"
"05.04.2021","YJA","YAPI KREDİ PORTFÖY PY ALSANCAK SERBEST ( DÖVİZ) ÖZEL FON","0,000000","0,00","0","0,00"
"05.04.2021","YKS","YAPI KREDİ PORTFÖY İSTANBUL SERBEST FON","0,044376","841.455.508,00","51","37.340.350,45"
"05.04.2021","YKT","YAPI KREDİ PORTFÖY ALTIN FONU","0,062212","26.584.971.723,00","17.325","1.653.897.257,91"
"05.04.2021","YLB","YAPI KREDİ PORTFÖY PARA PİYASASI FONU","0,332249","10.456.332.587,00","268.697","3.474.101.871,40"
"05.04.2021","YMM","YAPI KREDİ PORTFÖY EMİRGAN SERBEST (DÖVİZ) FON","8,750586","7.055.884,00","47","61.743.121,75"
"05.04.2021","YOA","YAPI KREDİ PORTFÖY PY BORÇLANMA ARAÇLARI (DÖVİZ) ÖZEL FONU","9,763087","61.028.660,00","289","595.828.119,27"
"05.04.2021","YOP","YAPI KREDİ PORTFÖY ODEABANK İKİNCİ SERBEST ÖZEL FON","1,137013","40.405.315,00","134","45.941.381,86"
"05.04.2021","YOT","YAPI KREDİ PORTFÖY ORTA VADELİ BORÇLANMA ARAÇLARI FONU","8,127709","16.488.392,01","9.075","134.012.845,84"
"05.04.2021","YPF","YAPI KREDİ PORTFÖY YEDİTEPE SERBEST FON","2,049784","10.059.495,00","14","20.619.796,54"
"05.04.2021","YPK","YAPI KREDİ PORTFÖY GALATA SERBEST FON","2,135415","86.520.297,00","50","184.756.759,35"
"05.04.2021","YPL","YAPI KREDİ PORTFÖY BALAT SERBEST (DÖVİZ) FON","8,992494","84.408.642,00","547","759.044.211,72"
"05.04.2021","YPP","YAPI KREDİ PORTFÖY PY KUZGUNCUK SERBEST ÖZEL FON","2,161236","120.151.208,00","1","259.675.173,87"
"05.04.2021","YPV","YAPI KREDİ PORTFÖY ÜÇÜNCÜ FON SEPETİ FONU","1,294126","1.419.082.335,00","3.311","1.836.470.660,21"
"05.04.2021","YPZ","YAPI KREDİ PORTFÖY PY LEVENT SERBEST ÖZEL FON","1,001474","50.070.960,00","1","50.144.748,99"
"05.04.2021","YRF","YAPI KREDİ PORTFÖY ODEABANK İKİNCİ SERBEST(DÖVİZ)ÖZEL FON","8,637673","4.959.578,00","77","42.839.211,43"
"05.04.2021","YRO","YAPI KREDİ PORTFÖY ODEABANK SERBEST (DÖVİZ)ÖZEL FON","8,650683","9.775.314,00","160","84.563.141,02"
"05.04.2021","YSF","YAPI KREDİ PORTFÖY DRAGOS SERBEST  FON","1,230772","10.835.932,00","7","13.336.561,07"
"05.04.2021","YSU","YAPI KREDİ PORTFÖY ÜÇÜNCÜ DEĞİŞKEN FON","0,022473","886.687.197,00","1.325","19.926.742,47"
"05.04.2021","YTD","YAPI KREDİ PORTFÖY YABANCI FON SEPETİ FONU","0,093973","1.123.381.474,00","2.983","105.567.840,91"
"05.04.2021","YYB","YAPI KREDİ PORTFÖY BEBEK SERBEST (DÖVİZ) FON","8,459603","6.015.000,00","32","50.884.513,24"
"05.04.2021","YZF","YAPI KREDİ PORTFÖY PY ERENKÖY  SERBEST (DÖVIZ) ÖZEL FON","8,427252","43.074.353,00","1","362.998.445,72"
"05.04.2021","YZG","YAPI KREDİ PORTFÖY GÜMÜŞ FON SEPETİ FONU","1,039489","140.918.322,00","5.629","146.483.084,50"
"05.04.2021","YZH","TEB PORTFÖY BIST BANKA ENDEKSİ HİSSE SENEDİ FONU (HİSSE SENEDİ YOĞUN)","0,718846","19.466.473,00","153","13.993.402,97"
"05.04.2021","YZK","YAPI KREDİ PORTFÖY KALAMIŞ SERBEST FON","1,179866","32.147.784,00","74","37.930.091,81"
"05.04.2021","ZAY","KT PORTFÖY SEPET HESAP PARA PİYASASI KATILIM FONU","1,090837","151.322.172,00","930","165.067.828,23"
"05.04.2021","ZBD","ZİRAAT PORTFÖY İKİNCİ DEĞİŞKEN FON","93,685765","141.051,84","1.292","13.214.550,47"
"05.04.2021","ZDD","ZİRAAT PORTFÖY BİRİNCİ DEĞİŞKEN FON","1,130400","6.278.596,00","238","7.097.323,52"
"05.04.2021","ZDZ","ZİRAAT PORTFÖY ÜÇÜNCÜ DEĞİŞKEN FON","1,115583","1.165.789,00","145","1.300.534,88"
"05.04.2021","ZPC","ZİRAAT PORTFÖY FON SEPETİ FONU","2,233279","11.980.097,00","1.102","26.754.902,96"
"05.04.2021","ZPE","ZİRAAT PORTFÖY KATILIM ENDEKSİ HİSSE SENEDİ FONU (HİSSE SENEDİ YOĞUN FON)","3,061677","28.174.678,51","2.694","86.261.754,46"
"05.04.2021","ZPF","ZİRAAT PORTFÖY KATILIM FONU (DÖVİZ)","3,126499","22.575.425,00","1.760","70.582.050,25"
"05.04.2021","ZPG","ZİRAAT PORTFÖY KİRA SERTİFİKALARI (SUKUK) KATILIM FONU","1,960729","37.223.148,95","2.090","72.984.491,49"
"05.04.2021","ZPK","ZİRAAT PORTFÖY KISA VADELİ KİRA SERTİFİKALARI KATILIM FONU","1,691294","388.272.168,00","6.853","656.682.429,84"
"05.04.2021","ZSF","ZİRAAT PORTFÖY S&P/OIC COMCEC (İSEDAK) 50 SHARİAH ENDEKSİ YABANCI HİSSE SENEDİ FONU","0,000000","0,00","0","0,00"
"05.04.2021","ZVB","ATLAS PORTFÖY İKİNCİ SERBEST FON","3,154341","7.578.773,00","4","23.906.032,11"
"06.04.2021","AAK","ATA PORTFÖY ÇOKLU VARLIK DEĞİŞKEN FON","4,427370","19.910.130,00","0","88.149.505,91"
"06.04.2021","AAL","ATA PORTFÖY PARA PİYASASI FONU","0,659697","462.602.457,69","0","305.177.562,23"
"06.04.2021","AAS","ATA PORTFÖY FON SEPETİ SERBEST FONU","3,460188","21.082.198,00","0","72.948.366,73"
"06.04.2021","AAV","ATA PORTFÖY İKİNCİ HİSSE SENEDİ FONU (HİSSE SENEDİ YOĞUN FON)","4,541426","39.959.789,00","0","181.474.430,15"
"06.04.2021","ABU","AK PORTFÖY BİREBİR BANKACILIK DEĞİŞKEN ÖZEL FON","0,021827","248.066.553,00","0","5.414.533,17"
"06.04.2021","ACC","İSTANBUL PORTFÖY DÖRDÜNCÜ HİSSE SENEDİ FONU (HİSSE SENEDİ YOĞUN)","2,680559","5.607.269,00","166","15.030.613,48"
"06.04.2021","ACD","İSTANBUL PORTFÖY İKİNCİ DEĞİŞKEN FON","0,415952","48.281.432,00","300","20.082.778,98"
"06.04.2021","ACK","İSTANBUL PORTFÖY HİSSE SENEDİ FONU(HİSSE SENEDİ YOĞUN FON)","0,057806","415.143.034,57","80","23.997.707,32"
"06.04.2021","ACN","İSTANBUL PORTFÖY LİDYA SERBEST (DÖVİZ) FON","1,915945","50.833.819,00","16","97.394.776,67"
"06.04.2021","ACU","İSTANBUL PORTFÖY URARTU SERBEST (DÖVİZ) FON","9,407559","9.862.143,00","52","92.778.692,30"
"06.04.2021","ACZ","İSTANBUL PORTFÖY HİTİT SERBEST FON","2,067004","24.607.400,00","5","50.863.584,64"
"06.04.2021","ADE","AK PORTFÖY DEĞİŞKEN FON","0,193560","1.299.692.482,00","0","251.568.235,16"
"06.04.2021","ADP","AK PORTFÖY BİST BANKA ENDEKSİ HİSSE SENEDİ FONU (HİSSE SENEDİ YOĞUN FON)","0,080414","553.426.900,00","1.238","44.503.383,94"
"06.04.2021","AED","ATA PORTFÖY BİRİNCİ DEĞİŞKEN FON","10,895817","6.830.746,00","0","74.426.555,56"
"06.04.2021","AES","AK PORTFÖY PETROL YABANCI BYF FON SEPETİ FONU","0,013488","21.074.860.059,00","2.697","284.265.476,16"
"06.04.2021","AFA","AK PORTFÖY  AMERİKA YABANCI HİSSE SENEDİ FONU","0,126464","1.572.548.470,00","2.012","198.870.773,39"
"06.04.2021","AFO","AK PORTFÖY ALTIN FONU","0,099617","7.198.597.118,00","12.646","717.100.589,70"
"06.04.2021","AFS","AK PORTFÖY SAĞLIK SEKTÖRÜ YABANCI HİSSE SENEDİ FONU","0,049334","4.648.934.848,00","1.770","229.352.246,63"
"06.04.2021","AFT","AK PORTFÖY YENİ TEKNOLOJİLER YABANCI HİSSE SENEDİ FONU","0,096341","17.282.489.135,00","10.338","1.665.006.640,39"
"06.04.2021","AFV","AK PORTFÖY  AVRUPA YABANCI HİSSE SENEDİ FONU","0,063890","1.616.534.866,00","823","103.280.766,98"
"06.04.2021","AGC","AK PORTFÖY AGI DEĞİŞKEN FON","1,442697","61.857.425,00","558","89.241.496,52"
"06.04.2021","AHI","ATLAS PORTFÖY BİRİNCİ HİSSE SENEDİ FONU(HİSSE SENEDİ YOĞUN)","2,098058","10.790.305,00","88","22.638.688,06"
"06.04.2021","AHN","ATLAS PORTFÖY SERBEST(DÖVİZ)FON","9,434410","2.908.791,00","24","27.442.726,60"
"06.04.2021","AHU","ATLAS PORTFÖY BİRİNCİ ÖZEL SEKTÖR BORÇLANMA ARAÇLARI FONU","1,847926","48.068.786,00","606","88.827.538,06"
"06.04.2021","AHV","AZİMUT PYŞ DENGELİ SERBEST FON","2,208498","118.048.824,00","0","260.710.644,09"
"06.04.2021","AHZ","AZİMUT PYŞ ATAK SERBEST FON","2,396424","11.761.116,00","0","28.184.619,12"
"06.04.2021","AIG","AZİMUT PORTFÖY İA SERBEST ÖZEL FON","3,091548","7.817.312,00","6","24.167.595,22"
"06.04.2021","AIH","AK PORTFÖY RTH SERBEST ÖZEL FON","1,507902","78.171.292,00","0","117.874.670,22"
"06.04.2021","AII","AZİMUT PORTFÖY ÇINAR SERBEST (DÖVİZ) ÖZEL FON","10,588145","5.407.200,00","0","57.252.218,55"
"06.04.2021","AIM","AK PORTFÖY MİMKA SERBEST ÖZEL FON","1,707855","43.367.680,00","4","74.065.691,14"
"06.04.2021","AIR","AZİMUT PORTFÖY ESİN SERBEST (DÖVİZ) ÖZEL FON","18,356006","11.050.344,00","0","202.840.183,80"
"06.04.2021","AIS","AK PORTFÖY KİRA SERTİFİKALARI KATILIM FONU","0,021420","867.291.749,00","997","18.577.281,06"
"06.04.2021","AJE","AK PORTFÖY ÜÇÜNCÜ SERBEST ( DÖVİZ ) FON","9,032429","65.640.552,00","164","592.893.604,24"
"06.04.2021","AJK","AK PORTFÖY İKINCI SERBEST (DÖVIZ) FON","9,413981","106.469.725,00","280","1.002.303.931,09"
"06.04.2021","AJL","AK PORTFÖY BEŞİNCİ SERBEST (DÖVIZ) FON","7,942976","114.255.349,00","517","907.527.463,00"
"06.04.2021","AJN","AK PORTFÖY DÖRDÜNCÜ SERBEST (DÖVIZ) FON","8,782952","49.320.526,00","352","433.179.814,07"
"06.04.2021","AKE","AK PORTFÖY EUROBOND (AMERİKAN DOLARI) BORÇLANMA ARAÇLARI FONU","0,068477","6.134.685.424,00","5.497","420.086.569,21"
"06.04.2021","AKU","AK PORTFÖY BİST 30 ENDEKSİ HİSSE SENEDİ FONU (HİSSE SENEDİ YOĞUN FON)","0,082034","563.568.348,00","0","46.231.593,88"
"06.04.2021","AK2","AK PORTFÖY UZUN VADELİ BORÇLANMA ARAÇLARI FONU","0,220734","215.480.027,00","10.358","47.563.837,38"
"06.04.2021","AK3","AK PORTFÖY HİSSE SENEDİ FONU (HİSSE SENEDİ YOĞUN FON)","2,998531","74.449.797,00","2.021","223.239.999,03"
"06.04.2021","ALC","AK PORTFÖY BİST TEMETTÜ 25 ENDEKSİ HİSSE SENEDİ FONU (HİSSE SENEDİ YOĞUN FON)","0,031538","1.473.662.039,00","3.898","46.476.939,92"
"06.04.2021","ALE","AK PORTFÖY PARA PIYASASI FONU","2,474102","1.213.992.471,00","34.767","3.003.541.542,58"
"06.04.2021","ANL","AK PORTFÖY ALTERNATİF BANK PARA PİYASASI FONU","6,634198","12.996.719,00","3","86.222.811,87"
"06.04.2021","ANZ","ATA PORTFÖY DÖRDÜNCÜ SERBEST (DÖVİZ) FON","2,772293","10.433.263,00","0","28.924.064,46"
"06.04.2021","AN1","STRATEJİ PORTFÖY BİRİNCİ DEĞİŞKEN FON","8,930389","215.533,54","0","1.924.798,31"
"06.04.2021","AOY","AK PORTFÖY ALTERNATİF ENERJİ YABANCI HİSSE SENEDİ FONU","0,108525","1.298.280.146,00","6.108","140.895.629,62"
"06.04.2021","APJ","AK PORTFÖY DÖRDÜNCÜ FON SEPETİ FONU","1,624170","55.794.382,00","285","90.619.583,31"
